{
    "$schema": "urn:pickle:schemas:artefacts:domains:application:physical:APP-CAT",
    "audience": [
        "Enterprise Architect",
        "Application Architect",
        "Chief Information Officer"
    ],
    "author": [
        "Application Architect",
        "Systems Analyst"
    ],
    "applications": [
        {
            "id": "APP-CAT-001",
            "vendor": "Salesforce",
            "product": "Sales Cloud",
            "aliases": [
                "SFDC"
            ],
            "description": "Customer relationship management platform for sales, service, and case management.",
            "status": "live",
            "lifecycle-stage": "maintain"
        },
        {
            "id": "APP-CAT-002",
            "vendor": "Oracle",
            "product": "Oracle Utilities Customer Self Service",
            "aliases": [
                "Oracle Utilities Customer Cloud Service"
            ],
            "description": "Self-service customer portal for account management, billing, and service requests.",
            "status": "live",
            "lifecycle-stage": "invest"
        },
        {
            "id": "APP-CAT-003",
            "vendor": "OutSystems",
            "product": "OutSystems",
            "aliases": [],
            "description": "Low-code platform used to build and maintain the customer mobile app.",
            "status": "live",
            "lifecycle-stage": "maintain"
        },
        {
            "id": "APP-CAT-004",
            "vendor": "Genesys",
            "product": "Genesys Cloud CX",
            "aliases": [],
            "description": "Cloud contact centre platform providing voice, chat, and email routing with an agent desktop.",
            "status": "live",
            "lifecycle-stage": "invest"
        },
        {
            "id": "APP-CAT-005",
            "vendor": "Salesforce",
            "product": "Marketing Cloud",
            "aliases": [],
            "description": "Campaign management and customer journey orchestration platform.",
            "status": "live",
            "lifecycle-stage": "maintain"
        },
        {
            "id": "APP-CAT-006",
            "vendor": "IBM",
            "product": "Maximo Application Suite",
            "aliases": [
                "IBM Maximo"
            ],
            "description": "Enterprise asset management suite covering asset register, work orders, and asset lifecycle.",
            "status": "live",
            "lifecycle-stage": "maintain"
        },
        {
            "id": "APP-CAT-007",
            "vendor": "Oracle",
            "product": "Oracle Field Service",
            "aliases": [
                "Oracle Field Service Cloud",
                "OFSC"
            ],
            "description": "Field service scheduling, dispatch, and mobile execution for field crews.",
            "status": "live",
            "lifecycle-stage": "invest"
        },
        {
            "id": "APP-CAT-008",
            "vendor": "PTC",
            "product": "ThingWorx",
            "aliases": [],
            "description": "Industrial IoT platform for edge-to-cloud telemetry from sensors, generators, and grid devices.",
            "status": "in-development",
            "lifecycle-stage": "invest"
        },
        {
            "id": "APP-CAT-009",
            "vendor": "ION Group",
            "product": "Endur",
            "aliases": [
                "ION Endur"
            ],
            "description": "Energy trading and risk management platform — deal capture, position, P&L, and settlement.",
            "status": "live",
            "lifecycle-stage": "maintain"
        },
        {
            "id": "APP-CAT-010",
            "vendor": "LSEG",
            "product": "Workspace",
            "aliases": [
                "Refinitiv Eikon"
            ],
            "description": "Wholesale price feeds, forward curves, and reference data for trading.",
            "status": "live",
            "lifecycle-stage": "maintain"
        },
        {
            "id": "APP-CAT-011",
            "vendor": "Murex",
            "product": "MX.3",
            "aliases": [],
            "description": "VaR, stress testing, and credit risk analytics for the trading book.",
            "status": "live",
            "lifecycle-stage": "invest"
        },
        {
            "id": "APP-CAT-012",
            "vendor": "GE Vernova",
            "product": "PowerOn Advantage",
            "aliases": [],
            "description": "Advanced supply management system for real-time monitoring and control of the supply portfolio.",
            "status": "live",
            "lifecycle-stage": "maintain"
        },
        {
            "id": "APP-CAT-013",
            "vendor": "Siemens",
            "product": "Spectrum Power",
            "aliases": [],
            "description": "Transmission-grid energy management system for real-time monitoring and control.",
            "status": "live",
            "lifecycle-stage": "maintain"
        },
        {
            "id": "APP-CAT-014",
            "vendor": "Oracle",
            "product": "Oracle Utilities Network Management System",
            "aliases": [
                "Oracle NMS"
            ],
            "description": "Outage prediction, dispatch, and customer communication for network outage management.",
            "status": "live",
            "lifecycle-stage": "maintain"
        },
        {
            "id": "APP-CAT-015",
            "vendor": "Esri",
            "product": "ArcGIS Utility Network",
            "aliases": [
                "ArcGIS"
            ],
            "description": "Spatial register of network assets, topology, and connectivity.",
            "status": "live",
            "lifecycle-stage": "maintain"
        },
        {
            "id": "APP-CAT-016",
            "vendor": "Oracle",
            "product": "Oracle Utilities Customer Care & Billing",
            "aliases": [
                "Oracle CC&B",
                "CC&B"
            ],
            "description": "Customer information system providing account management, meter-to-cash, and billing.",
            "status": "live",
            "lifecycle-stage": "tolerate"
        },
        {
            "id": "APP-CAT-017",
            "vendor": "Oracle",
            "product": "Oracle Utilities Revenue Management and Billing",
            "aliases": [
                "Oracle ORMB",
                "ORMB"
            ],
            "description": "Pricing and billing engine for complex tariff calculation and revenue management.",
            "status": "live",
            "lifecycle-stage": "invest"
        },
        {
            "id": "APP-CAT-018",
            "vendor": "Oracle",
            "product": "Oracle Utilities Meter Data Management",
            "aliases": [
                "Oracle MDM"
            ],
            "description": "Validates, estimates, and stores meter reading data for billing and analytics.",
            "status": "live",
            "lifecycle-stage": "maintain"
        },
        {
            "id": "APP-CAT-019",
            "vendor": "Itron",
            "product": "Itron Enterprise Edition",
            "aliases": [
                "IEE"
            ],
            "description": "Head-end system for smart meter communication and meter reading collection.",
            "status": "live",
            "lifecycle-stage": "maintain"
        },
        {
            "id": "APP-CAT-020",
            "vendor": "Workiva",
            "product": "Workiva",
            "aliases": [],
            "description": "Connected reporting platform used to produce regulatory and statutory reports.",
            "status": "live",
            "lifecycle-stage": "maintain"
        },
        {
            "id": "APP-CAT-021",
            "vendor": "Persefoni",
            "product": "Persefoni Climate Management & Accounting Platform",
            "aliases": [
                "Persefoni CMAP"
            ],
            "description": "Carbon accounting platform for measuring and managing greenhouse-gas emissions.",
            "status": "in-development",
            "lifecycle-stage": "invest"
        },
        {
            "id": "APP-CAT-022",
            "vendor": "Diligent",
            "product": "Diligent ESG",
            "aliases": [],
            "description": "ESG data management and disclosure platform.",
            "status": "in-development",
            "lifecycle-stage": "invest"
        },
        {
            "id": "APP-CAT-023",
            "vendor": "Databricks",
            "product": "Databricks Lakehouse Platform",
            "aliases": [],
            "description": "Unified analytics and data lakehouse platform for ingesting and curating data across the estate.",
            "status": "live",
            "lifecycle-stage": "invest"
        },
        {
            "id": "APP-CAT-024",
            "vendor": "Oracle",
            "product": "Oracle Enterprise Data Management Cloud",
            "aliases": [
                "Oracle EDM Cloud",
                "Oracle EDMCS"
            ],
            "description": "Master and reference data management for enterprise hierarchies and golden records.",
            "status": "live",
            "lifecycle-stage": "maintain"
        },
        {
            "id": "APP-CAT-025",
            "vendor": "Oracle",
            "product": "Oracle Analytics Cloud",
            "aliases": [
                "OAC"
            ],
            "description": "Enterprise business intelligence and reporting platform.",
            "status": "live",
            "lifecycle-stage": "maintain"
        },
        {
            "id": "APP-CAT-026",
            "vendor": "AWS",
            "product": "Amazon SageMaker",
            "aliases": [],
            "description": "Machine learning platform used to build, train, and deploy predictive models.",